{
  "decisionId": "auth-semantiq-v0.1.0-alpha.1",
  "approvedReleaseLevel": "level_2_public_alpha",
  "approvedComponents": [
    "packages/semantiq",
    "docs",
    "schemas",
    "governance",
    "trust",
    "high-impact",
    "benchmark-integrity",
    "rubrics",
    "disputes",
    "self-observation",
    "release-simulation"
  ],
  "excludedComponents": [
    "tier_d_protected_challenge_fixtures"
  ],
  "conditions": [
    "Maintain local workspace containment until Phase 12 initialization",
    "Keep release-freeze.json active",
    "Preserve boundary-validator and clean-room-validator enforcement"
  ],
  "expirationDate": "2026-11-01T00:00:00Z",
  "unresolvedRisks": [
    "Maintainer concentration (60% core maintainer ratio)",
    "Low-resource language human reviewer validation expansion required for Phase 12"
  ],
  "rollbackTrigger": "Discovery of credential leak, unhandled prompt injection, or claim boundary breach",
  "responsibleMaintainers": [
    "SemantIQ Core Governance Board"
  ],
  "evidenceManifestLinks": [
    "PHASE_11_5_FINAL_READINESS_REPORT.md",
    "PHASE_11_5_9_COMPLETION_REPORT.md",
    "release-simulation/RELEASE_SIMULATION_RESULTS.md"
  ],
  "dissentingOpinions": [],
  "isPhase12Approved": true,
  "timestamp": "2026-08-07T12:00:00Z"
}
